{
  "fields": {
    "Cause and Origin": "",
    "Code Items": "",
    "Contents": "",
    "DATE_INSPECTED": "",
    "DATE_LOSS": "",
    "DATE_RECEIVED": "",
    "Date of Loss": "",
    "Dwelling Description": "",
    "INSURED_H_CITY": "",
    "INSURED_H_STATE": "",
    "INSURED_H_STREET": "",
    "INSURED_H_ZIP": "",
    "INSURED_NAME": "",
    "Inspection": "",
    "Insurable Interest": "",
    "MICA/QA Assist": "",
    "MORTGAGE_CO": "",
    "MORTGAGEE": "",
    "Mortgagee Information": "",
    "Other Structures": "",
    "Overhead & Profit": "",
    "Priors": "",
    "Property Condition": "",
    "Review": "",
    "Salvage": "",
    "Subrogation": "",
    "Supplement": "",
    "TOL_CODE": ""
  },
  "filled_values": {
    "Cause and Origin": "Wind damage",
    "Code Items": "",
    "Contents": "The member had power outage on the DOL resulting in of food loss of $500.",
    "DATE_INSPECTED": "11/13/2024",
    "DATE_LOSS": "",
    "DATE_RECEIVED": "",
    "Date of Loss": "",
    "Dwelling Description": "The Dwelling risk is a 1 story residential building with 25 year 3 tab shingles on the roof and brick veneer on the elevations.\nThe dwelling roof is a 5/12 one story gable roof with 25 year 3-tab shingles installed as a single layer. Felt and drip edge is present. The roof is approximately 20 years old.\nSingle layer, drip edge\n5/12 pitch\n25 year 3 tab shingles\n1 ft overhang\nPVC ridge vent\n5 pipe jacks\nFront slope is North facing",
    "INSURED_H_CITY": "",
    "INSURED_H_STATE": "",
    "INSURED_H_STREET": "",
    "INSURED_H_ZIP": "",
    "INSURED_NAME": "Richard Daly",
    "Inspection": "",
    "Insurable Interest": "The members mortgage company was verified as .",
    "MICA/QA Assist": "",
    "MORTGAGE_CO": "The members mortgage company was verified as .",
    "MORTGAGEE": "The members mortgage company was verified as .",
    "Mortgagee Information": "The members mortgage company was verified as .",
    "Other Structures": "Detached garage overview\nDetached garage roof is comprised of 3-tab shingles\nSingle layer, drip edge\n25 year 3-tab shingles\n6/12 pitch\nPVC ridge vent\nRight slope is free from wind damage\nLeft slope has 26 wind damaged shingles\nMissing/damaged shingles from wind\nMissing/damaged shingles from wind\nMissing/damaged shingles from wind\nMissing/damaged shingles from wind\nMissing/damaged shingles from wind\nRear slope free from storm damage\nFront elevation is free from wind damage\nRight elevation is free from wind damage\nRear elevation is free from wind damage\nLeft elevation is free from wind damage",
    "Overhead & Profit": "",
    "Priors": "",
    "Property Condition": "Dwelling Roof:\nFront slope has 13 wind damaged shingles\nMissing/damaged shingles from wind\nMissing/damaged shingles from wind\nMissing/damaged shingles from wind\nMissing/damaged shingles from wind\nMissing/damaged shingles from wind\nRear slope has 150 wind damaged shingles\nMissing/damaged shingles from wind\nMissing/damaged shingles from wind\nMissing/damaged shingles from wind\nMissing/damaged shingles from wind\nMissing/damaged shingles from wind\nDwelling Elevations:\nFront elevation: Fascia displaced\nRight elevation: Right elevation is free from wind damage\nRear elevation: Fascia damaged\nFascia damaged/displaced\nA.C unit free from damage\nA.C unit free from damage\nMissing/damaged fascia\nLeft elevation: Fascia displaced\nFascia displaced",
    "Review": "",
    "Salvage": "",
    "Subrogation": "",
    "Supplement": "",
    "TOL_CODE": ""
  },
  "report_excerpt": "Photo Sheet\nInsured:\nRichard Daly\nClaim #:\n014646994-801\nPolicy #:\n014646994-95A\nAlacrity Solutions\nA USAA Service Provider\nPO BOX  33490\nSan Antonio, TX 78265\n800-531-8722\nPhoto Sheet\n- 1 -\n11/13/2024\n1-Risk Identifier\nDate Taken: 11/13/2024\nTaken By:\nJacob Richards\nRisk address\n2-Risk Overview\nDate Taken: 11/13/2024\nTaken By:\nJacob Richards\nThe Dwelling risk is a 1 story residential\nbuilding with 25 year 3 tab shingles on\nthe roof and brick veneer on the\nelevations. The members mortgage\ncompany was verified as . The member\nhad power outage on the DOL resulting\nin of food loss of $500.\n\nPhoto Sheet\nInsured:\nRichard Daly\nClaim #:\n014646994-801\nPolicy #:\n014646994-95A\nAlacrity Solutions\nA USAA Service Provider\nPO BOX  33490\nSan Antonio, TX 78265\n800-531-8722\nPhoto Sheet\n- 2 -\n11/13/2024\n3-Dwelling Roof\nDate Taken: 11/13/2024\nTaken By:\nJacob Richards\nThe dwelling roof is a 5/12 one story\ngable roof with 25 year 3-tab shingles\ninstalled as a single layer. Felt and drip\nedge is present. The roof is\napproximately 20 years old.\n4-Dwelling Roof\nDate Taken: 11/13/2024\nTaken By:\nJacob Richards\nSingle layer, drip edge\n\n3\nPhoto Sheet\nInsured:\nRichard Daly\nClaim #:\n014646994-801\nPolicy #:\n014646994-95A\nAlacrity Solutions\nA USAA Service Provider\nPO BOX  33490\nSan Antonio, TX 78265\n800-531-8722\nPhoto Sheet\n- 3 -\n11/13/2024\n5-Dwelling Roof\nDate Taken: 11/13/2024\nTaken By:\nJacob Richards\n5/12 pitch\n6-Dwelling Roof\nDate Taken: 11/13/2024\nTaken By:\nJacob Richards\n25 year 3 tab shingles\n\nPhoto Sheet\nInsured:\nRichard Daly\nClaim #:\n014646994-801\nPolicy #:\n014646994-95A\nAlacrity Solutions\nA USAA Service Provider\nPO BOX  33490\nSan Antonio, TX 78265\n800-531-8722\nPhoto Sheet\n- 4 -\n11/13/2024\n7-Dwelling Roof\nDate Taken: 11/13/2024\nTaken By:\nJacob Richards\n1 ft overhang\n8-Dwelling Roof\nDate Taken: 11/13/2024\nTaken By:\nJacob Richards\nRoof overview\n\n5\nPhoto Sheet\nInsured:\nRichard Daly\nClaim #:\n014646994-801\nPolicy #:\n014646994-95A\nAlacrity Solutions\nA USAA Service Provider\nPO BOX  33490\nSan Antonio, TX 78265\n800-531-8722\nPhoto Sheet\n- 5 -\n11/13/2024\n9-Dwelling Roof\nDate Taken: 11/13/2024\nTaken By:\nJacob Richards\nPVC ridge vent\n10-Dwelling Roof\nDate Taken: 11/13/2024\nTaken By:\nJacob Richards\n5 pipe jacks\n\n6\nPhoto Sheet\nInsured:\nRichard Daly\nClaim #:\n014646994-801\nPolicy #:\n014646994-95A\nAlacrity Solutions\nA USAA Service Provider\nPO BOX  33490\nSan Antonio, TX 78265\n800-531-8722\nPhoto Sheet\n- 6 -\n11/13/2024\n11-Dwelling Roof\nDate Taken: 11/13/2024\nTaken By:\nJacob Richards\nFront slope overview\n12-Dwelling Roof\nDate Taken: 11/13/2024\nTaken By:\nJacob Richards\nFront slope is North facing\n\nPhoto Sheet\nInsured:\nRichard Daly\nClaim #:\n014646994-801\nPolicy #:\n014646994-95A\nAlacrity Solutions\nA USAA Service Provider\nPO BOX  33490\nSan Antonio, TX 78265\n800-531-8722\nPhoto Sheet\n- 7 -\n11/13/2024\n13-Dwelling Roof\nDate Taken: 11/13/2024\nTaken By:\nJacob Richards\nFront slope has 13 wind damaged\nshingles\n14-Dwelling Roof\nDate Taken: 11/13/2024\nTaken By:\nJacob Richards\nMissing/damaged shingles from wind\n\n8\nPhoto Sheet\nInsured:\nRichard Daly\nClaim #:\n014646994-801\nPolicy #:\n014646994-95A\nAlacrity Solutions\nA USAA Service Provider\nPO BOX  33490\nSan Antonio, TX 78265\n800-531-8722\nPhoto Sheet\n- 8 -\n11/13/2024\n15-Dwelling Roof\nDate Taken: 11/13/2024\nTaken By:\nJacob Richards\nMissing/damaged shingles from wind\n16-Dwelling Roof\nDate Taken: 11/13/2024\nTaken By:\nJacob Richards\nMissing/damaged shingles from wind\n\n9\nPhoto Sheet\nInsured:\nRichard Daly\nClaim #:\n014646994-801\nPolicy #:\n014646994-95A\nAlacrity Solutions\nA USAA Service Provider\nPO BOX  33490\nSan Antonio, TX 78265\n800-531-8722\nPhoto Sheet\n- 9 -\n11/13/2024\n17-Dwelling Roof\nDate Taken: 11/13/2024\nTaken By:\nJacob Richards\nMissing/damaged shingles from wind\n18-Dwelling Roof\nDate Taken: 11/13/2024\nTaken By:\nJacob Richards\nMissing/damaged shingles from wind\n\n0\nPhoto Sheet\nInsured:\nRichard Daly\nClaim #:\n014646994-801\nPolicy #:\n014646994-95A\nAlacrity Solutions\nA USAA Service Provider\nPO BOX  33490\nSan Antonio, TX 78265\n800-531-8722\nPhoto Sheet\n- 10 -\n11/13/2024\n19-Dwelling Roof\nDate Taken: 11/13/2024\nTaken By:\nJacob Richards\nRear slope overview\n20-Dwelling Roof\nDate Taken: 11/13/2024\nTaken By:\nJacob Richards\nRear slope has 150 wind damaged\nshingles\n\nPhoto Sheet\nInsured:\nRichard Daly\nClaim #:\n014646994-801\nPolicy #:\n014646994-95A\nAlacrity Solutions\nA USAA Service Provider\nPO BOX  33490\nSan Antonio, TX 78265\n800-531-8722\nPhoto Sheet\n- 11 -\n11/13/2024\n21-Dwelling Roof\nDate Taken: 11/13/2024\nTaken By:\nJacob Richards\nMissing/damaged shingles from wind\n22-Dwelling Roof\nDate Taken: 11/13/2024\nTaken By:\nJacob Richards\nMissing/damaged shingles from wind\n\nPhoto Sheet\nInsured:\nRichard Daly\nClaim #:\n014646994-801\nPolicy #:\n014646994-95A\nAlacrity Solutions\nA USAA Service Provider\nPO BOX  33490\nSan Antonio, TX 78265\n800-531-8722\nPhoto Sheet\n- 12 -\n11/13/2024\n23-Dwelling Roof\nDate Taken: 11/13/2024\nTaken By:\nJacob Richards\nMissing/damaged shingles from wind\n24-Dwelling Roof\nDate Taken: 11/13/2024\nTaken By:\nJacob Richards\nMissing/damag",
  "docx_path": "C:\\Users\\Asus\\OneDrive\\Desktop\\ProductizeTech\\Task-3\\task_3_output\\filled_template_1722ab469e124fadbbe39247a0dd9efd.docx",
  "pdf_path": "C:\\Users\\Asus\\OneDrive\\Desktop\\ProductizeTech\\Task-3\\task_3_output\\filled_template_1722ab469e124fadbbe39247a0dd9efd.pdf"
}